{
  "document": {
    "id": "cl.spec.v1",
    "status": "review_candidate",
    "repo": "mjgolaszewski/clauditor",
    "source_commit": "6fc4c5913f10f33d84f310ef1ca13e7da98a22b0",
    "date": "2026-10-23",
    "active_profile": "lite",
    "target_contract": "standard v3 controller-free",
    "runtime_authority": false,
    "release_authority": false
  },
  "doctrine": {
    "id": "cl.doctrine.v1",
    "owner": "cl.owner.governance.v1",
    "chain": [
      "invariants",
      "canonical ownership/laws",
      "primitives",
      "state machines",
      "operations/contracts",
      "producers/consumers",
      "implementation/evidence",
      "evaluation/admission"
    ],
    "construction": "Dependency-outward after mechanically closed contracts; preserve first then migrate",
    "human_docs": "Generated only, no independent semantic authority"
  },
  "owners": [
    {
      "id": "cl.owner.source.v1",
      "scope": "Anthropic documented emitter capability, content flags, version/plan eligibility, coverage gaps"
    },
    {
      "id": "cl.owner.ingress.v1",
      "scope": "OTLP receiver, TLS/header authentication, durable stage receipts, intake rejection"
    },
    {
      "id": "cl.owner.archive.v1",
      "scope": "Typed semantically faithful OTLP archive, custody, protected holds"
    },
    {
      "id": "cl.owner.storage.v1",
      "scope": "ClickHouse SQL analytical representation, retention, idempotency"
    },
    {
      "id": "cl.owner.query.v1",
      "scope": "Grafana OSS reporting, session correlation and evidence exports"
    },
    {
      "id": "cl.owner.security.v1",
      "scope": "Local identity, access, data confidentiality and untrusted content"
    },
    {
      "id": "cl.owner.alert.v1",
      "scope": "Rules, notifications, acknowledgements, rule provenance"
    },
    {
      "id": "cl.owner.deployment.v1",
      "scope": "Docker Compose, sizing, health, backup and restore"
    },
    {
      "id": "cl.owner.governance.v1",
      "scope": "Source interpretations, owner changes, BCF adoption and construction admissibility"
    }
  ],
  "invariants": [
    {
      "id": "cl.invariant.semantic_owner.v1",
      "owner": "cl.owner.governance.v1",
      "property": "Every normative concept and transition has exactly one canonical domain owner.",
      "violation": "cl.failure.semantic_owner.v1"
    },
    {
      "id": "cl.invariant.actual_source.v1",
      "owner": "cl.owner.source.v1",
      "property": "No event, prompt, response, tool result or file body is considered observed unless its enabled source emitted it.",
      "violation": "cl.failure.actual_source.v1"
    },
    {
      "id": "cl.invariant.coverage.v1",
      "owner": "cl.owner.source.v1",
      "property": "Cloud/web/unsupported capability gaps are explicit; lack of telemetry is not proof of inactivity.",
      "violation": "cl.failure.coverage.v1"
    },
    {
      "id": "cl.invariant.content_status.v1",
      "owner": "cl.owner.source.v1",
      "property": "Content is classified full, metadata_only, redacted, truncated, placeholder, not_emitted or unknown from evidence.",
      "violation": "cl.failure.content_status.v1"
    },
    {
      "id": "cl.invariant.otlp_compliance.v1",
      "owner": "cl.owner.ingress.v1",
      "property": "OTLP traces, metrics and logs decode with standard signal types and reject malformed/unauthorized traffic.",
      "violation": "cl.failure.otlp_compliance.v1"
    },
    {
      "id": "cl.invariant.receipt_stages.v1",
      "owner": "cl.owner.ingress.v1",
      "property": "Ingress accepted, durable archive, SQL indexed and complete provider delivery are separate, non-equivalent propositions.",
      "violation": "cl.failure.receipt_stages.v1"
    },
    {
      "id": "cl.invariant.typed_record.v1",
      "owner": "cl.owner.archive.v1",
      "property": "Semantically faithful typed OTLP source envelopes are preserved independently of potentially lossy SQL projections.",
      "violation": "cl.failure.typed_record.v1"
    },
    {
      "id": "cl.invariant.exact_identity.v1",
      "owner": "cl.owner.storage.v1",
      "property": "Replayed delivery does not double-count one logical observation; ambiguous identities are not silently merged.",
      "violation": "cl.failure.exact_identity.v1"
    },
    {
      "id": "cl.invariant.retention.v1",
      "owner": "cl.owner.storage.v1",
      "property": "Retention target is 365 days, 90-day fallback requires administrative choice, 31-day floor, held records protected.",
      "violation": "cl.failure.retention.v1"
    },
    {
      "id": "cl.invariant.least_access.v1",
      "owner": "cl.owner.security.v1",
      "property": "Local admin/viewer identities and read-only database access protect all sensitive data; no anonymous reporting.",
      "violation": "cl.failure.least_access.v1"
    },
    {
      "id": "cl.invariant.inert_input.v1",
      "owner": "cl.owner.security.v1",
      "property": "Telemetry payload and prompt/tool content remain data and cannot become executable HTML, SQL, configuration or policy.",
      "violation": "cl.failure.inert_input.v1"
    },
    {
      "id": "cl.invariant.correlation.v1",
      "owner": "cl.owner.query.v1",
      "property": "Only authentic source-issued correlation keys justify joins; missing or conflicting keys remain visible.",
      "violation": "cl.failure.correlation.v1"
    },
    {
      "id": "cl.invariant.bounded_export.v1",
      "owner": "cl.owner.query.v1",
      "property": "Query/export requires authorized role, bounded filters, safe output encoding and manifest provenance.",
      "violation": "cl.failure.bounded_export.v1"
    },
    {
      "id": "cl.invariant.alerts.v1",
      "owner": "cl.owner.alert.v1",
      "property": "Alert rules apply to observable predicates; estimated costs, silence and content gaps cannot imply proven wrongdoing.",
      "violation": "cl.failure.alerts.v1"
    },
    {
      "id": "cl.invariant.resilience.v1",
      "owner": "cl.owner.deployment.v1",
      "property": "Queue pressure, backend failures, disk limits, lost signals and failed restores remain visible and recoverable where possible.",
      "violation": "cl.failure.resilience.v1"
    },
    {
      "id": "cl.invariant.no_fees.v1",
      "owner": "cl.owner.deployment.v1",
      "property": "Appliance ships with no license-fee or mandatory paid cloud dependencies.",
      "violation": "cl.failure.no_fees.v1"
    },
    {
      "id": "cl.invariant.edge_closure.v1",
      "owner": "cl.owner.governance.v1",
      "property": "Independent required flows must each have one complete 10-dimension edge contract; other pairs require typed exclusion.",
      "violation": "cl.failure.edge_closure.v1"
    },
    {
      "id": "cl.invariant.state_closure.v1",
      "owner": "cl.owner.governance.v1",
      "property": "Every state-event cell has one transition contract or typed exclusion and every declared state is reachable.",
      "violation": "cl.failure.state_closure.v1"
    },
    {
      "id": "cl.invariant.authority.v1",
      "owner": "cl.owner.governance.v1",
      "property": "No candidate specification, agent, hash or local test can grant BCF governance admission or regulator-grade certification.",
      "violation": "cl.failure.authority.v1"
    },
    {
      "id": "cl.invariant.preservation.v1",
      "owner": "cl.owner.governance.v1",
      "property": "Existing BCF Lite governance and unrelated files are preserved unless reviewed supersession explicitly authorizes a change.",
      "violation": "cl.failure.preservation.v1"
    },
    {
      "id": "cl.invariant.cheap_first.v1",
      "owner": "cl.owner.deployment.v1",
      "property": "Cheap structural checks precede costly integration, execution and evidence qualification; reuse only applicable evidence.",
      "violation": "cl.failure.cheap_first.v1"
    }
  ],
  "laws": [
    {
      "id": "cl.law.coverage.v1",
      "owner": "cl.owner.source.v1",
      "invariants": [
        "cl.invariant.actual_source.v1",
        "cl.invariant.coverage.v1",
        "cl.invariant.content_status.v1"
      ],
      "property": "Coverage must derive from enabled, version-qualified emitters and source-origin availability indicators."
    },
    {
      "id": "cl.law.transport.v1",
      "owner": "cl.owner.ingress.v1",
      "invariants": [
        "cl.invariant.otlp_compliance.v1",
        "cl.invariant.receipt_stages.v1"
      ],
      "property": "Decode, authenticate, qualify, accept/buffer, archive and index through separately observed stages."
    },
    {
      "id": "cl.law.custody.v1",
      "owner": "cl.owner.archive.v1",
      "invariants": [
        "cl.invariant.typed_record.v1",
        "cl.invariant.exact_identity.v1"
      ],
      "property": "Typed OTLP archive is source-faithful after decode, not necessarily byte-identical to the received HTTP request."
    },
    {
      "id": "cl.law.access.v1",
      "owner": "cl.owner.security.v1",
      "invariants": [
        "cl.invariant.least_access.v1",
        "cl.invariant.inert_input.v1",
        "cl.invariant.bounded_export.v1"
      ],
      "property": "UI/backend operations use role checks, read-only SQL credentials and safe representation of content."
    },
    {
      "id": "cl.law.retention.v1",
      "owner": "cl.owner.storage.v1",
      "invariants": [
        "cl.invariant.retention.v1",
        "cl.invariant.resilience.v1"
      ],
      "property": "Pressure creates alerts; it does not silently shorten or delete protected retention."
    },
    {
      "id": "cl.law.alerts.v1",
      "owner": "cl.owner.alert.v1",
      "invariants": [
        "cl.invariant.alerts.v1",
        "cl.invariant.coverage.v1"
      ],
      "property": "No output confers investigative certainty beyond its observed basis."
    },
    {
      "id": "cl.law.edge.v1",
      "owner": "cl.owner.governance.v1",
      "invariants": [
        "cl.invariant.edge_closure.v1",